{
  "$schema": "/data/provenance/schema.json",
  "id": "amavasya-tharpanam",
  "type": "sacred-text",
  "url": "/amavasya-tharpanam/",
  "title": "Amavasya Tharpanam",
  "work": {
    "title": "Amavasya Tharpanam",
    "language": "Sanskrit"
  },
  "attribution": {},
  "sources": [],
  "editor": "Paddy Iyer",
  "translation": {
    "by": null,
    "note": "The English meanings on this page were prepared for PaddySpeaks; the source files do not record a separate translator or edition for them."
  },
  "status": "source-not-recorded",
  "verification": [],
  "knownIssues": [],
  "lastReviewed": null,
  "recordedFrom": null,
  "recordedText": null,
  "citation": {
    "scheme": "section"
  },
  "statusNote": "The source file for this page does not record where its text was taken from. It is shown here rather than hidden; a source should be added on the next review."
}
