{
  "$schema": "/data/provenance/schema.json",
  "id": "vishnu-sahasranama",
  "type": "sacred-text",
  "url": "/vishnu-sahasranama/",
  "title": "Vishnu Sahasranama",
  "work": {
    "title": "Vishnu Sahasranama",
    "language": "Sanskrit"
  },
  "attribution": {
    "composer": "Bhishma–Yudhishthira samvada",
    "traditionalLocation": "Mahabharata, Anushasana Parva, chapter 149"
  },
  "sources": [
    {
      "role": "text",
      "label": "Mahabharata, Anushasana Parva (chapter 149)",
      "kind": "primary",
      "note": "Traditional location of the text as stated in the source file; no specific edition is recorded."
    },
    {
      "role": "commentary",
      "label": "Adi Shankaracharya's Bhashya",
      "kind": "primary",
      "note": "Meanings are stated to be based on this commentary; no edition is recorded."
    },
    {
      "role": "reference",
      "label": "vishnusahasranama.pdf",
      "url": "/vishnu-sahasranama/vishnusahasranama.pdf",
      "kind": "reference",
      "note": "Reference document kept in the repository. Its own origin is not recorded."
    }
  ],
  "editor": "Paddy Iyer",
  "translation": {
    "by": null,
    "note": "The English meanings on this page were prepared for PaddySpeaks; the source files do not record a separate translator or edition for them."
  },
  "status": "source-noted",
  "verification": [],
  "knownIssues": [],
  "lastReviewed": null,
  "recordedFrom": "vishnu-sahasranama/data.js header comment",
  "recordedText": "Source: Mahabharata, Anushasana Parva (Chapter 149) / Meanings: Based on Adi Shankaracharya's Bhashya",
  "citation": {
    "scheme": "name"
  }
}
