{
  "$schema": "/data/provenance/schema.json",
  "id": "purusha-suktam",
  "type": "sacred-text",
  "url": "/purusha-suktam/",
  "title": "Purusha Suktam",
  "work": {
    "title": "Purusha Suktam",
    "language": "Sanskrit"
  },
  "attribution": {
    "composer": "Rishi: Narayana",
    "traditionalLocation": "Rig Veda 10.90, Taittiriya Aranyaka 3.12, Vajasaneyi Samhita 31"
  },
  "sources": [
    {
      "role": "text",
      "label": "Rig Veda 10.90; Taittiriya Aranyaka 3.12; Vajasaneyi Samhita 31",
      "kind": "primary",
      "note": "Traditional location of the text as stated in the source file; no specific edition is recorded."
    }
  ],
  "editor": "Paddy Iyer",
  "translation": {
    "by": null,
    "note": "The English meanings on this page were prepared for PaddySpeaks; the source files do not record a separate translator or edition for them."
  },
  "status": "source-noted",
  "verification": [],
  "knownIssues": [],
  "lastReviewed": null,
  "recordedFrom": "purusha-suktam/data.js header comment",
  "recordedText": "Source: Rig Veda 10.90, Taittiriya Aranyaka 3.12, Vajasaneyi Samhita 31 / Rishi: Narayana",
  "citation": {
    "scheme": "verse"
  }
}
