{
  "$schema": "/data/provenance/schema.json",
  "id": "narayaneeyam",
  "type": "sacred-text",
  "url": "/narayaneeyam/",
  "title": "Narayaneeyam",
  "work": {
    "title": "Narayaneeyam",
    "language": "Sanskrit"
  },
  "attribution": {
    "composer": "Melpathur Narayana Bhattathiri",
    "note": "Named in the page's own commentary; the source file carries no source comment."
  },
  "sources": [],
  "editor": "Paddy Iyer",
  "translation": {
    "by": null,
    "note": "The English meanings on this page were prepared for PaddySpeaks; the source files do not record a separate translator or edition for them."
  },
  "status": "source-not-recorded",
  "verification": [],
  "knownIssues": [],
  "lastReviewed": null,
  "recordedFrom": null,
  "recordedText": null,
  "citation": {
    "scheme": "dashaka.verse",
    "example": "Narayaneeyam 1.1"
  },
  "statusNote": "The source file for this page does not record where its text was taken from. It is shown here rather than hidden; a source should be added on the next review."
}
