{
  "$schema": "/data/provenance/schema.json",
  "id": "rama-raksha-stotram",
  "type": "sacred-text",
  "url": "/rama-raksha-stotram/",
  "title": "Rama Raksha Stotram",
  "work": {
    "title": "Rama Raksha Stotram",
    "language": "Sanskrit"
  },
  "attribution": {
    "composer": "Sage Budha Kaushika"
  },
  "sources": [
    {
      "role": "text",
      "label": "shlokam.org",
      "url": "https://shlokam.org/",
      "kind": "secondary"
    },
    {
      "role": "text",
      "label": "sanskritdocuments.org",
      "url": "https://sanskritdocuments.org/",
      "kind": "secondary"
    }
  ],
  "editor": "Paddy Iyer",
  "translation": {
    "by": null,
    "note": "The English meanings on this page were prepared for PaddySpeaks; the source files do not record a separate translator or edition for them."
  },
  "status": "source-noted",
  "verification": [],
  "knownIssues": [],
  "lastReviewed": null,
  "recordedFrom": "rama-raksha-stotram/data.js header comment",
  "recordedText": "Composed by: Sage Budha Kaushika / Source: Traditional / shlokam.org / sanskritdocuments.org",
  "citation": {
    "scheme": "verse"
  }
}
