{
  "$schema": "/data/provenance/schema.json",
  "id": "hanuman-chalisa",
  "type": "sacred-text",
  "url": "/hanumanchalisa/",
  "title": "Hanuman Chalisa",
  "work": {
    "title": "Hanuman Chalisa",
    "language": "Awadhi"
  },
  "attribution": {
    "composer": "Goswami Tulsidas (16th century)"
  },
  "sources": [],
  "editor": "Paddy Iyer",
  "translation": {
    "by": null,
    "note": "The English meanings on this page were prepared for PaddySpeaks; the source files do not record a separate translator or edition for them."
  },
  "status": "source-not-recorded",
  "verification": [],
  "knownIssues": [],
  "lastReviewed": null,
  "recordedFrom": "hanumanchalisa/data.js header comment",
  "recordedText": "Source: Traditional text by Goswami Tulsidas (16th century) / With Hindi (Devanagari) original and English translations",
  "citation": {
    "scheme": "verse"
  },
  "statusNote": "The source file records the traditional attribution of this work, but not the edition, book or website its text was taken from. A text source should be added on the next review."
}
