{
  "$schema": "/data/provenance/schema.json",
  "id": "durga-suktam",
  "type": "sacred-text",
  "url": "/durga-suktam/",
  "title": "Durga Suktam",
  "work": {
    "title": "Durga Suktam",
    "language": "Sanskrit"
  },
  "attribution": {
    "composer": "Rishi: various",
    "traditionalLocation": "Mahanarayana Upanishad (Taittiriya Aranyaka 10)"
  },
  "sources": [
    {
      "role": "text",
      "label": "Mahanarayana Upanishad (Taittiriya Aranyaka 10)",
      "kind": "primary",
      "note": "Traditional location of the text as stated in the source file; no specific edition is recorded."
    }
  ],
  "editor": "Paddy Iyer",
  "translation": {
    "by": null,
    "note": "The English meanings on this page were prepared for PaddySpeaks; the source files do not record a separate translator or edition for them."
  },
  "status": "source-noted",
  "verification": [],
  "knownIssues": [],
  "lastReviewed": null,
  "recordedFrom": "durga-suktam/data.js header comment",
  "recordedText": "Source: Mahanarayana Upanishad (Taittiriya Aranyaka 10)",
  "citation": {
    "scheme": "verse"
  }
}
