{
  "$schema": "/data/provenance/schema.json",
  "id": "navagraha",
  "type": "sacred-text",
  "url": "/navagraha/",
  "title": "Navagraha Slokas",
  "work": {
    "title": "Navagraha Slokas",
    "language": "Sanskrit"
  },
  "attribution": {
    "traditionalLocation": "Navagraha Suktam (Vedic tradition) and Navagraha Peedahara Stotram (Brahmanda Purana)"
  },
  "sources": [
    {
      "role": "text",
      "label": "Navagraha Suktam (Vedic); Navagraha Peedahara Stotram (Brahmanda Purana)",
      "kind": "primary",
      "note": "Traditional location of the text as stated in the source file; no specific edition is recorded."
    },
    {
      "role": "reference",
      "label": "navagraha.pdf",
      "url": "/navagraha/navagraha.pdf",
      "kind": "reference",
      "note": "Reference document kept in the repository. Its own origin is not recorded."
    },
    {
      "role": "reference",
      "label": "Navagraha peeta hara slokam.pdf",
      "url": "/navagraha/Navagraha peeta hara slokam.pdf",
      "kind": "reference",
      "note": "Reference document kept in the repository. Its own origin is not recorded."
    }
  ],
  "editor": "Paddy Iyer",
  "translation": {
    "by": null,
    "note": "The English meanings on this page were prepared for PaddySpeaks; the source files do not record a separate translator or edition for them."
  },
  "status": "source-noted",
  "verification": [],
  "knownIssues": [],
  "lastReviewed": null,
  "recordedFrom": "navagraha/data.js header comment",
  "recordedText": "Navagraha Suktam (Vedic Tradition) + Navagraha Peedahara Stotram (Brahmanda Purana)",
  "citation": {
    "scheme": "verse"
  }
}
