{
  "$schema": "/data/provenance/schema.json",
  "id": "bhagavad-gita",
  "type": "sacred-text",
  "url": "/bhagavad-gita/",
  "title": "Srimad Bhagavad Gita",
  "work": {
    "title": "Srimad Bhagavad Gita",
    "language": "Sanskrit"
  },
  "attribution": {
    "composer": "Vyasa (traditional attribution)",
    "traditionalLocation": "Mahabharata, Bhishma Parva",
    "note": "Vyasa is named in the first Gita Dhyanam verse carried in the same data file ('vyāsena grathitāṁ')."
  },
  "sources": [
    {
      "role": "text",
      "label": "Mahabharata, Bhishma Parva",
      "kind": "primary",
      "note": "Traditional location of the text as stated in the source file; no specific edition is recorded."
    }
  ],
  "editor": "Paddy Iyer",
  "translation": {
    "by": null,
    "note": "The English meanings on this page were prepared for PaddySpeaks; the source files do not record a separate translator or edition for them."
  },
  "status": "source-noted",
  "verification": [],
  "knownIssues": [],
  "lastReviewed": null,
  "recordedFrom": "bhagavad-gita/data.js header comment",
  "recordedText": "Source: Traditional Bhagavad Gita from the Mahabharata (Bhishma Parva)",
  "citation": {
    "scheme": "chapter.verse",
    "example": "Bhagavad Gita 2.47"
  }
}
