{
  "$schema": "/data/provenance/schema.json",
  "id": "shashti-kavacham",
  "type": "sacred-text",
  "url": "/shashtikavacham/",
  "title": "Kanda Shashti Kavacham",
  "work": {
    "title": "Kanda Shashti Kavacham",
    "language": "Tamil"
  },
  "attribution": {
    "composer": "Devaraya Swamigal, Thiruchendur"
  },
  "sources": [],
  "editor": "Paddy Iyer",
  "translation": {
    "by": null,
    "note": "The English meanings on this page were prepared for PaddySpeaks; the source files do not record a separate translator or edition for them."
  },
  "status": "source-not-recorded",
  "verification": [],
  "knownIssues": [],
  "lastReviewed": null,
  "recordedFrom": "shashtikavacham/data.js header comment",
  "recordedText": "Composed by Devaraya Swamigal at Thiruchendur / Tamil text with English transliteration",
  "citation": {
    "scheme": "section"
  },
  "statusNote": "The source file records the traditional attribution of this work, but not the edition, book or website its text was taken from. A text source should be added on the next review."
}
