{
  "$schema": "/data/provenance/schema.json",
  "id": "abhirami-andhadhi",
  "type": "sacred-text",
  "url": "/abhirami-andhadhi/",
  "title": "Abhirami Andhadhi",
  "work": {
    "title": "Abhirami Andhadhi",
    "language": "Tamil"
  },
  "attribution": {
    "composer": "Abhirami Bhattar, Thirukkadaiyur"
  },
  "sources": [
    {
      "role": "text",
      "label": "sivaya.org (Thirumurai Group)",
      "url": "https://www.sivaya.org/",
      "kind": "secondary",
      "note": "Tamil text sourced from here, per the source file. Transliteration is ISO 15919."
    }
  ],
  "editor": "Paddy Iyer",
  "translation": {
    "by": null,
    "note": "The English meanings on this page were prepared for PaddySpeaks; the source files do not record a separate translator or edition for them."
  },
  "status": "under-review",
  "verification": [
    {
      "method": "Automated consistency check: the word-by-word interpretation layer must reproduce every word of the committed Tamil text, and every Lalitha Sahasranama cross-link must resolve.",
      "tool": ".github/scripts/validate_abhirami.js",
      "runs": "every pull request (Validate Content)",
      "scope": "internal consistency — it does not re-check the Tamil against sivaya.org"
    }
  ],
  "knownIssues": [
    {
      "since": "2026-09-18",
      "summary": "The inherited English meanings are misaligned with the Tamil for a substantial number of verses (for example verses 10, 12, 24, 25, 54 and 100). The 17 interpreted verses carry corrected renderings built from their word breakdowns; every other verse is labelled 'Working translation — under review' on the page.",
      "tracking": "docs/SESSION-HANDOFF.md"
    }
  ],
  "lastReviewed": null,
  "recordedFrom": "abhirami-andhadhi/data.js header comment",
  "recordedText": "Source: Traditional text by Abhirami Bhattar, Thirukkadaiyur / Tamil text sourced from sivaya.org (Thirumurai Group) / With ISO 15919 transliteration and English meanings",
  "citation": {
    "scheme": "verse"
  }
}
