{
  "$schema": "/data/provenance/schema.json",
  "id": "sandhyavandanam",
  "type": "sacred-text",
  "url": "/sandhyavandanam/",
  "title": "Sandhyavandanam",
  "work": {
    "title": "Sandhyavandanam",
    "language": "Sanskrit"
  },
  "attribution": {},
  "sources": [
    {
      "role": "reference",
      "label": "Sandhyavandanam Answers.pdf",
      "url": "/sandhyavandanam/Sandhyavandanam Answers.pdf",
      "kind": "reference",
      "note": "Reference document kept in the repository. Its own origin is not recorded."
    },
    {
      "role": "reference",
      "label": "Sandhyavandanam_A_Forgotten_Science.pdf",
      "url": "/sandhyavandanam/Sandhyavandanam_A_Forgotten_Science.pdf",
      "kind": "reference",
      "note": "Reference document kept in the repository. Its own origin is not recorded."
    }
  ],
  "editor": "Paddy Iyer",
  "translation": {
    "by": null,
    "note": "The English meanings on this page were prepared for PaddySpeaks; the source files do not record a separate translator or edition for them."
  },
  "status": "source-not-recorded",
  "verification": [],
  "knownIssues": [],
  "lastReviewed": null,
  "recordedFrom": null,
  "recordedText": null,
  "citation": {
    "scheme": "section"
  },
  "statusNote": "The source file for this page does not record where its text was taken from. The reference documents below are kept in the repository, but their own origin is not recorded either. A source should be added on the next review."
}
